projects:
  - title: "Successfully Completing Side-projects"
    description: "Tips and strategy for completing side projects."
    image: sideprojectsblog.png
    date: 09/18/2016
    machine_date: 2016/09/18
    url: http://williamanderson.io/blog/successfully-completing-side-projects.html
    blog: true
    subdued: true
    summary: It can be tough to work on your passions after hours, but its not impossible, I share some tips.

  - title: "Fermi Pasteladox"
    description: "A procedural universe in Python"
    image: fermipasteladox.png
    date: 09/03/2016
    machine_date: 2016/09/03
    url: https://twitter.com/FermiPasteladox
    summary: "A cute procedural universe in Python made for #fermiJam"
    featured: true

  - title: "Sea Bees"
    description: "A virtual pet toy in collaboration with Xiwi Electronics"
    image: seabees.jpg
    date: 08/29/2016
    machine_date: 2016/08/29
    url: https://www.patreon.com/posts/sea-bees-6680627
    summary: Arduino/C++ in collaboration with Xiwi Electronics
    featured: true

  - title: "Monster Hull"
    description: "Shmup RPG built for Pico-8 using Lua"
    image: monsterhull.png
    date: 07/22/2016
    machine_date: 2016/07/22
    url: http://www.lexaloffle.com/bbs/?tid=3908
    summary: Pixel art, Lua code, concepting and more was a blast, and Im so happy with how Monster Hull came out. I feel a Shmup/Monster Training RPG combo is quite unique. Promo Art by Yi-Ting Anderson. SFX+Music by Brendan Byrne.

  - title: "2016 Personal website refresh"
    description: "Static site built in Grow.io"
    image: williamanderson2016.png
    date: 07/01/2016
    machine_date: 2016/07/01
    url: https://github.com/william-index/williamanderson2016
    summary: Updating my brand a little, and making my site more focused to listing my personal projects.

  - title: "#004 - Composed on a 'Destiny Clock'"
    description: "P-Comp Composed Midi"
    image: 004.png
    date: 06/12/2016
    machine_date: 2016/06/12
    url: https://soundcloud.com/bigwetdognose/004a
    summary: Song composed on a Destiny Clock, retro RPG winter town inspired.

  - title: "Wax, The Hippo - for Pico-8"
    description: "Platformer game built in Lua"
    image: waxthehippo.png
    date: 05/26/2016
    machine_date: 2016/05/26
    url: http://www.lexaloffle.com/bbs/?tid=3461
    summary: 8-bit platformer written in Lua for Pico-8

  - title: "Random Wizard Generator"
    description: "Python Twitter bot"
    image: wizardgenerator.png
    date: 04/09/2016
    machine_date: 2016/04/09
    url: https://twitter.com/wizardgenerator
    summary: Python-based twitter bot that generates random wizard with color replacement as image patterns.

  - title: "Fantastic Real Estate Bot"
    description: "Python Twitter bot"
    image: fantasticrealestate.png
    date: 04/02/2016
    machine_date: 2016/04/02
    url: https://twitter.com/FantasyListings
    summary: Python-based twitter bot that makes fake and fantastic real estate listings.

  - title: "CSS Dragon Radar"
    description: "CSS illustration"
    image: dragonradar.jpg
    date: 03/12/2016
    machine_date: 2016/03/12
    url: http://codepen.io/william-index/full/PNGqyN/
    summary: Dragon Radar from Dragon Ball anime series. CSS Only.

  - title: "Microservices All the Way Down"
    description: "Blogpost on Software Architecture"
    image: microservices.png
    date: 02/15/2016
    machine_date: 2016/02/15
    url: http://williamanderson.io/blog/microservices-all-the-way-down.html
    blog: true
    summary: The Microservices pattern is intensely popular right now in software development, but in other fields it always has been. In a way its even been around in software for longer than we think too.

  - title: "Personal Mascot (5 color)"
    description: "Illustration"
    image: mascotchara.png
    date: 01/30/2016
    machine_date: 2016/01/30
    url: http://thewa.tumblr.com/post/138323546238/ive-been-wanting-to-make-myself-a-mascot
    summary: I've been wanting to make myself a mascot character along these lines for a while. Been playing a lot of Kirby's Dreamland lately, and the oldschool Gameboy colors were inspiring, so I decided to step up and make this. Its me! Check out that patterned shirt! Its a hippo type thing?

  - title: "Vapor Vase"
    description: "CSS Art"
    image: vaporvase.png
    date: 01/23/2016
    machine_date: 2016/01/23
    url: http://codepen.io/william-index/pen/zrRWWP
    summary: Im not 100% why or what, I just let the style take me wherever they lead me, and this is where I landed. CSS can be a medium for art just as much as anything else.

  - title: "Exobotany in Pixels"
    description: "Pixel Art"
    image: exobotany_pixelart.png
    date: 01/18/2016
    machine_date: 2016/01/18
    url: http://thewa.tumblr.com/post/137574290383/weekend-micro-project-just-for-fun
    summary: Plants from the furthest reaches of retro blacklight-pixel space.

  - title: "2015 Year in Review"
    description: "Blogpost"
    image: yir2015.png
    date: 01/10/2016
    machine_date: 2016/01/10
    url: http://williamanderson.io/blog/year-in-review-2015.html
    blog: true
    summary: My look back at what I did during 2015.

  - title: "Sass Maze Algorithms 2"
    description: "CSS experiment"
    image: mazealgos2.jpg
    date: 12/12/2015
    machine_date: 2015/12/12
    url: http://codepen.io/william-index/pen/qbONZE
    summary: A radial maze generated with Sass and css only.

  - title: "Sass Maze Algorithms"
    description: "CSS experiment"
    image: mazealgos.jpg
    date: 12/06/2015
    machine_date: 2015/12/06
    url: http://codepen.io/william-index/pen/YwzjPr?editors=110
    summary: The first 2 maze algorithms from "Mazes for Programmers" reworked to be in sass and css.

  - title: "Swarming Fungi"
    description: "CSS experiment"
    image: swarmingfungi.jpg
    date: 11/15/2015
    machine_date: 2015/11/15
    url: http://codepen.io/william-index/pen/meaYXr
    summary: A CSS experiment for swarming particle based on mouse position with random variation.

  - title: "Start '98"
    description: "Traditional painting"
    image: start98.jpg
    date: 11/08/2015
    machine_date: 2015/11/08
    url: http://thewa.tumblr.com/post/132830546243/my-first-real-painting-kinda-titled-start-98
    summary: My first real painting so to speak, acrylic on wood with paper mache and shadows.

  - title: "Bat Cannon"
    description: "iOS Game built in Swift"
    image: batcannon.gif
    date: 10/29/2015
    machine_date: 2015/10/29
    url: https://itunes.apple.com/us/app/bat-cannon/id1044096597?mt=8

  - title: "Halloween Pens 2015"
    description: "CSS illustration"
    image: halloweenpens2015.jpg
    date: 10/31/2015
    machine_date: 2015/10/31
    url: http://codepen.io/collection/DxKkkg/
    summary: Just some quick CSS doodles on halloween.

  - title: "90s Space Suit - Therapy"
    description: "Plunderphonics electronic music"
    image: nintiesspacesuit.jpg
    date: 10/24/2015
    machine_date: 2015/10/24
    url: https://hipponautic.bandcamp.com/album/90s-space-suit
    summary: My first try ever at music. Made with garageband and samples from a 1980s self-hypnosis video.

  - title: "Logic and State Management with just CSS"
    description: "Blogpost"
    image: css_logic.jpg
    date: 10/17/2015
    machine_date: 2015/10/17
    url: http://williamanderson.io/blog/logic-and-states-with-css.html
    blog: true

  - title: "CSS-only Calculator"
    description: "CSS experiment"
    image: halfbyteadder.gif
    date: 10/10/2015
    machine_date: 2015/10/10
    url: http://codepen.io/william-index/pen/jbwggX

  - title: "Qorxon: Cruise Control"
    description: "CSS experiment"
    image: qorxon.jpg
    date: 10/04/2015
    machine_date: 2015/10/04
    url: http://codepen.io/william-index/pen/qOrXON/

  - title: "HTML to Audio Converter"
    description: "Web Experiment"
    image: html2audio.jpg
    date: 09/06/2015
    machine_date: 2015/09/06
    url: http://codepen.io/william-index/full/jbEpeK/

  - title: "Speaking to Machines"
    description: "Blogpost"
    image: machinecode.jpg
    date: 08/28/2015
    machine_date: 2015/08/28
    url: http://williamanderson.io/blog/speaking-to-machines.html
    blog: true

  - title: "CSS-only Connect 4"
    description: "CSS experiment"
    image: connect4.png
    date: 08/22/2015
    machine_date: 2015/08/22
    url: http://codepen.io/william-index/full/waLLzY/

  - title: "Callie Splatoon Fanart"
    description: "Illustration"
    image: callie_splatoon.png
    date: 08/15/2015
    machine_date: 2015/08/15
    url: http://thewa.tumblr.com/post/126718721058/callie-from-splatoon

  - title: "CSS Stepped 8bit Animation"
    description: "CSS experiment"
    image: 8bit_frames.png
    date: 07/24/2015
    machine_date: 2015/07/24
    url: http://codepen.io/william-index/full/QbZvoQ/

  - title: "Paper Mache Daruma"
    description: "A japanese doll made of paper mache"
    image: paperdaruma.jpg
    date: 07/19/2015
    machine_date: 2015/07/19
    url: https://twitter.com/TheWAAnderson/status/622907853507051520

  - title: "CSS Daruma"
    description: "A japanese doll made of CSS"
    image: cssdaruma.png
    date: 07/19/2015
    machine_date: 2015/07/19
    url: http://codepen.io/william-index/pen/pJZpgN

  - title: "Placemat"
    description: "An HTML table preprocessor"
    image: plmat.gif
    date: 04/12/2015
    machine_date: 2015/04/12
    url: http://william-index.github.io/placemat/index.html

  - title: "Captain's Log"
    description: "Twitter run table-top game"
    image: captainslog.jpg
    date: 01/08/2014
    machine_date: 2014/01/08
    url: http://captainsloggame.com/

  - title: "WEAMON: Weather Monsters"
    description: "iOS Games (Obj-C)"
    image: weamon.jpg
    date: 12/12/2013
    machine_date: 2015/12/12
    url: http://www.weamon.com/

  - title: "Pettrip"
    description: "iOS Games (Obj-C)"
    image: pettrip.jpg
    date: 07/19/2013
    machine_date: 2013/07/19
    url: http://williamanderson.io/index_interactive/pettrip/
